{
  "stage": "prepared",
  "definition_id": "qwen3-vl-8b-single",
  "definition_sha256": "aea18c822589c2acbce8a5b5f12d8b58b504a7eec2f554c1a45a1641d6bcfe94",
  "runtime_manifest_sha256": "8022bd60dd108dce87adf1aae411b727af2cb037bc053fcfdaeaf151155d528b",
  "source": {
    "repository": "https://github.com/QwenLM/Qwen3-VL",
    "commit": "96588727e44c78b25ba03ea03b8e12f7e64fd0da"
  },
  "checkpoint": {
    "repository": "Qwen/Qwen3-VL-8B-Instruct",
    "revision": "0c351dd01ed87e9c1b53cbc748cba10e6187ff3b",
    "manifest_sha256": null
  },
  "image": {
    "reference": "nvcr.io/nvidia/cuda:13.0.1-devel-ubuntu24.04@sha256:7d2f6a8c2071d911524f95061a0db363e24d27aa51ec831fcccf9e76eb72bc92"
  },
  "recorded_at": "2026-08-03T15:56:00Z",
  "nodes": [
    {"node": "spark2", "boot_id": "abeace49-049a-4c8c-b079-b4ce66793b67"}
  ],
  "predecessor": null,
  "gates": {
    "artifacts": true,
    "node_manifests": true
  }
}
