{
  "stage": "verified",
  "definition_id": "deepseek-agent-dual",
  "definition_sha256": "e096ea632459aa0496bbd383433fee6b2a6dfe9caa8f72628230004883c012d5",
  "runtime_manifest_sha256": "452cb5736f2a56061b827f211d539f113a23ce43938e769a3c6cee0bdf733c29",
  "source": {
    "repository": "https://github.com/MiaAI-Lab/DeepSeek-v4-Flash-DSpark-2x-DGX-Spark",
    "commit": "b131b2a22164675890dd1465fd8862b5cfb6ff13"
  },
  "checkpoint": {
    "repository": "deepseek-ai/DeepSeek-V4-Flash-0731",
    "revision": "9e165c30e2704aec5d9d593cce3eebd58bbef1cb",
    "manifest_sha256": "82e965c1caa019b31f4d776d0b3eddb0cc0d8e076f189822b8a3bbe3fa115121"
  },
  "image": {
    "reference": "ghcr.io/anemll/dspark-vllm-gx10@sha256:a83948492cf13df455170fb42885f5ef4db54fefe0feff0f841ecbff464ac9d8"
  },
  "recorded_at": "2026-08-02T21:23:21Z",
  "nodes": [
    {
      "node": "spark1",
      "boot_id": "276acc0c-2dc5-424d-9499-92dcd8452bcb"
    },
    {
      "node": "spark2",
      "boot_id": "f9eae13d-4f8d-451c-9ab1-136eb82d516b"
    }
  ],
  "predecessor": "inventory/reports/model-definitions/deepseek-agent-dual-prepared.json",
  "gates": {
    "offline": true,
    "release": true,
    "image": true,
    "architecture": true,
    "fabric": true,
    "role": true,
    "compose": true
  }
}
