{
  "stage": "prepared",
  "definition_id": "triposg-single",
  "definition_sha256": "c5471ed948cd4174fb14a0afbadad1de6954b31e0f58181dae12a334c86871c0",
  "runtime_manifest_sha256": "925d467ef469043eaf3eedf0fc40a03e93fac7bd3def42b713859e53dacd7469",
  "source": {
    "repository": "https://github.com/VAST-AI-Research/TripoSG",
    "commit": "fc5c40990181e2a756c4e0b1c2f4d6b5202faf8c"
  },
  "checkpoint": {
    "repository": "VAST-AI/TripoSG",
    "revision": "2c1c516d22d58db486a058d98d31bb6177344e06",
    "manifest_sha256": null
  },
  "image": {
    "reference": "nvcr.io/nvidia/pytorch:25.11-py3@sha256:4a85d8cf6fb3a943280960b8948cf4e9b6eca77b4414c68c9b2c7bb863f79b70"
  },
  "recorded_at": "2026-08-03T14:31:00Z",
  "nodes": [
    {"node": "spark2", "boot_id": "abeace49-049a-4c8c-b079-b4ce66793b67"}
  ],
  "predecessor": null,
  "gates": {
    "artifacts": true,
    "node_manifests": true
  }
}
